[
    {
        "name": "Grey Gables Hotel",
        "also_known_as": [
            "Grey Gables",
            "the Gables"
        ],
        "type": "Company",
        "notes": "This is the hotel in Ambridge where Ian Craig works as a chef",
        "people": [
            {
                "name": "Roy Tucker",
                "role": "Ian's manager"
            },
            {
                "name": "Lynda Snell",
                "role": "Receptionist"
            }
        ]
    },
    {
        "name": "The Bull",
        "also_known_as": [
            "the pub"
        ],
        "type": "Company",
        "notes": "This is the popular village pub in the village of Ambridge, where a lot of Kenton's family and friends live, work and socialise",
        "people": [
            {
                "name": "Fallon Rogers",
                "role": "Landlady"
            },
            {
                "name": "Wayne Tucson",
                "role": "Chef"
            }
        ]
    }
]